docPid,docName,left_context,context,right_context,lemma,pos,pos_head,pos_buiging,pos_conjtype,pos_dial,pos_genus,pos_getal,pos_getal_n,pos_graad,pos_lwtype,pos_naamval,pos_npagr,pos_ntype,pos_numtype,pos_pdtype,pos_persoon,pos_positie,pos_pvagr,pos_pvtijd,pos_spectype,pos_status,pos_vwtype,pos_vztype,pos_wvorm,phonetic,xmlid,begintime,endtime
WR-P-P-G-0000195183,Macht en onmacht van de journalistiek," , gaat hij wel heel",snel door de bocht," . Moeilijk , ja .",snel door de bocht,"ADJ(vrij,basis,zonder) VZ(init) LID(bep,stan,rest) N(soort,ev,basis,zijd,stan)",ADJ VZ LID N,,,,,,,,,,,,,,,,,,,,,,,"   ",p.12.s.7.w.19 p.12.s.7.w.20 p.12.s.7.w.21 p.12.s.7.w.22,"   ","   "
WR-P-P-G-0000441315,"Twee ongevallen, vier doden"," ging allicht met te hoge",snelheid door een bocht," . Hij verloor de controle",snelheid door een bocht,"N(soort,ev,basis,zijd,stan) VZ(init) LID(onbep,stan,agr) N(soort,ev,basis,zijd,stan)",N VZ LID N,,,,,,,,,,,,,,,,,,,,,,,"   ",p.5.s.2.w.11 p.5.s.2.w.12 p.5.s.2.w.13 p.5.s.2.w.14,"   ","   "
WR-P-P-G-0000244041,Werknemers luchthaven testen openbaar vervoer," Dat enthousiasme is vermoedelijk te",verklaren door de Bocht," van Nossegem . De reacties",verklaren door de Bocht,"WW(inf,vrij,zonder) VZ(init) LID(bep,stan,rest) SPEC(deeleigen)",WW VZ LID SPEC,,,,,,,,,,,,,,,,,,,,,,,"   ",p.5.s.2.w.6 p.5.s.2.w.7 p.5.s.2.w.8 p.5.s.2.w.9,"   ","   "
WR-P-P-G-0000007160,Val minister van Duitse deelstaat," alleen had gereisd . Schleusser",moest door de bocht," nadat een piloot tegenover een",moeten door de bocht,"WW(pv,verl,ev) VZ(init) LID(bep,stan,rest) N(soort,ev,basis,zijd,stan)",WW VZ LID N,,,,,,,,,,,,,,,,,,,,,,,"   ",p.3.s.1.w.2 p.3.s.1.w.3 p.3.s.1.w.4 p.3.s.1.w.5,"   ","   "
WR-P-P-G-0000020161,Derde Astra komt er aan," adaptieve verlichting , waarbij de",koplampen door de bocht," heen schijnen , inclusief een",koplamp door de bocht,"N(soort,mv,basis) VZ(init) LID(bep,stan,rest) N(soort,ev,basis,zijd,stan)",N VZ LID N,,,,,,,,,,,,,,,,,,,,,,,"   ",p.4.s.1.w.20 p.4.s.1.w.21 p.4.s.1.w.22 p.4.s.1.w.23,"   ","   "
WR-P-P-G-0000007429,"'Ik wil Leurs wel, maar dan helemaal'"," ' dat ik met piepende",banden door de bocht," scheur met een boterham in",band door de bocht,"N(soort,mv,basis) VZ(init) LID(bep,stan,rest) N(soort,ev,basis,zijd,stan)",N VZ LID N,,,,,,,,,,,,,,,,,,,,,,,"   ",p.5.s.4.w.18 p.5.s.4.w.19 p.5.s.4.w.20 p.5.s.4.w.21,"   ","   "
WR-P-P-G-0000438042,Boonen slaagt in opzet en is leiderstrui kwijt," verkend , Wilfried Peeters heeft",me door de bochten," moeten loodsen Dat Boonen zaterdag",me door de bocht,"VNW(pr,pron,obl,red,1,ev) VZ(init) LID(bep,stan,rest) N(soort,mv,basis)",VNW VZ LID N,,,,,,,,,,,,,,,,,,,,,,,"   ",p.1.s.4.w.9 p.1.s.4.w.10 p.1.s.4.w.11 p.1.s.4.w.12,"   ","   "
WR-P-P-G-0000165838,Gezellig als Oranje-goden swingen door straten van Porto," , ging de Noord-Portugese stad",toch door de bocht," : de Supporters Club Oranje",toch door de bocht,"BW() VZ(init) LID(bep,stan,rest) N(soort,ev,basis,zijd,stan)",BW VZ LID N,,,,,,,,,,,,,,,,,,,,,,,"   ",p.2.s.2.w.12 p.2.s.2.w.13 p.2.s.2.w.14 p.2.s.2.w.15,"   ","   "
WR-P-P-G-0000414688,Werken aan De Valkaart starten na bouwverlof," naar links vaak tot gevaarlijke",situaties door de bocht," in de Rodenbachstraat . Bij",situatie door de bocht,"N(soort,mv,basis) VZ(init) LID(bep,stan,rest) N(soort,ev,basis,zijd,stan)",N VZ LID N,,,,,,,,,,,,,,,,,,,,,,,"   ",p.3.s.5.w.11 p.3.s.5.w.12 p.3.s.5.w.13 p.3.s.5.w.14,"   ","   "
WR-P-P-G-0000534635,Sneller door de bocht,,Sneller door de bocht," Alfa verlegt opnieuw grenzen .",snel door de bocht,"ADJ(vrij,comp,zonder) VZ(init) LID(bep,stan,rest) N(soort,ev,basis,zijd,stan)",ADJ VZ LID N,,,,,,,,,,,,,,,,,,,,,,,"   ",head.1.s.1.w.1 head.1.s.1.w.2 head.1.s.1.w.3 head.1.s.1.w.4,"   ","   "
WR-P-P-G-0000132992,Het onverzettelijke symbool van 't Heike," de Aubisque rechtdoor in plaats",van door de bocht," . Met aan elkaar geknoopte",van door de bocht,"VZ(init) VZ(init) LID(bep,stan,rest) N(soort,ev,basis,zijd,stan)",VZ VZ LID N,,,,,,,,,,,,,,,,,,,,,,,"   ",p.6.s.2.w.30 p.6.s.2.w.31 p.6.s.2.w.32 p.6.s.2.w.33,"   ","   "
WR-P-P-G-0000309671,Verfijnde luxe in sportoutfit," leren ' hoe sportief je",graag door de bochten," gaat . Rekening houdend met",graag door de bocht,"BW() VZ(init) LID(bep,stan,rest) N(soort,mv,basis)",BW VZ LID N,,,,,,,,,,,,,,,,,,,,,,,"   ",p.14.s.10.w.12 p.14.s.10.w.13 p.14.s.10.w.14 p.14.s.10.w.15,"   ","   "
WR-P-P-G-0000571242,"""Seizoen is al geslaagd"," je bent , hoe beter",je door de bochten," slingert "" , lacht Nathalie",je door de bocht,"VNW(pers,pron,nomin,red,2v,ev) VZ(init) LID(bep,stan,rest) N(soort,mv,basis)",VNW VZ LID N,,,,,,,,,,,,,,,,,,,,,,,"   ",p.3.s.6.w.16 p.3.s.6.w.17 p.3.s.6.w.18 p.3.s.6.w.19,"   ","   "
WR-P-P-G-0000142519,Ullrich neemt te veel risico bij laatste aanval," , maar durfde niet meer",vol door de bochten," . Hij realiseerde zich dat",vol door de bocht,"ADJ(vrij,basis,zonder) VZ(init) LID(bep,stan,rest) N(soort,mv,basis)",ADJ VZ LID N,,,,,,,,,,,,,,,,,,,,,,,"   ",p.15.s.1.w.12 p.15.s.1.w.13 p.15.s.1.w.14 p.15.s.1.w.15,"   ","   "
WR-P-P-G-0000696964,Hattrick voor Nys op zijn Koppenberg," Niet superieur bergop , wat",gereserveerd door de bochten," , af en toe slippend",reserveren door de bocht,"WW(vd,vrij,zonder) VZ(init) LID(bep,stan,rest) N(soort,mv,basis)",WW VZ LID N,,,,,,,,,,,,,,,,,,,,,,,"   ",p.3.s.6.w.6 p.3.s.6.w.7 p.3.s.6.w.8 p.3.s.6.w.9,"   ","   "
WR-P-P-G-0000075122,De koning der schaatsenrijders," om dan verder met kleine",pasjes door de bochten," te trippelen . Zeker is",pas door de bocht,"N(soort,mv,dim) VZ(init) LID(bep,stan,rest) N(soort,mv,basis)",N VZ LID N,,,,,,,,,,,,,,,,,,,,,,,"   ",p.9.s.4.w.24 p.9.s.4.w.25 p.9.s.4.w.26 p.9.s.4.w.27,"   ","   "
WR-P-P-G-0000101021,Het laatste suikerbrood van Jos en Tjitske," wist hij de wagen wel",goed door de bocht," te leiden , maar viel",goed door de bocht,"ADJ(vrij,basis,zonder) VZ(init) LID(bep,stan,rest) N(soort,ev,basis,zijd,stan)",ADJ VZ LID N,,,,,,,,,,,,,,,,,,,,,,,"   ",p.14.s.4.w.21 p.14.s.4.w.22 p.14.s.4.w.23 p.14.s.4.w.24,"   ","   "
WR-P-P-G-0000200971,Erik Zabel is nog maar eens tweede," denk dat ik nooit zo",snel door een bocht," ben gereden . Toen ik",snel door een bocht,"ADJ(vrij,basis,zonder) VZ(init) LID(onbep,stan,agr) N(soort,ev,basis,zijd,stan)",ADJ VZ LID N,,,,,,,,,,,,,,,,,,,,,,,"   ",p.2.s.3.w.7 p.2.s.3.w.8 p.2.s.3.w.9 p.2.s.3.w.10,"   ","   "
WR-P-P-G-0000007537,Te kort door de bocht," en met te hoge snelheid",- door de bocht," . ",- door de bocht,"LET() VZ(init) LID(bep,stan,rest) N(soort,ev,basis,zijd,stan)",LET VZ LID N,,,,,,,,,,,,,,,,,,,,,,,"   ",p.7.s.2.w.27 p.7.s.2.w.28 p.7.s.2.w.29 p.7.s.2.w.30,"   ","   "
WR-P-P-G-0000138979,G.F. Handel door Le Concert Spirituel," Handel die op twee wielen",gierend door de bocht," gaat . Al dat natuurgeweld",gieren door de bocht,"WW(od,vrij,zonder) VZ(init) LID(bep,stan,rest) N(soort,ev,basis,zijd,stan)",WW VZ LID N,,,,,,,,,,,,,,,,,,,,,,,"   ",p.3.s.1.w.11 p.3.s.1.w.12 p.3.s.1.w.13 p.3.s.1.w.14,"   ","   "
WR-P-P-G-0000694164,"""Ik kwam om te winnen"," gingen , kwam ik als",eerste door de bocht," . Zo was ik zegezeker",eerst door de bocht,"TW(rang,nom,zonder-n) VZ(init) LID(bep,stan,rest) N(soort,ev,basis,zijd,stan)",TW VZ LID N,,,,,,,,,,,,,,,,,,,,,,,"   ",p.9.s.4.w.13 p.9.s.4.w.14 p.9.s.4.w.15 p.9.s.4.w.16,"   ","   "
WR-P-P-G-0000075319,Het groeit én het krimpt," groeit én het krimpt Is",Europa door de bocht," ? Morgen publiceren zowel Frankrijk",Europa door de bocht,"SPEC(deeleigen) VZ(init) LID(bep,stan,rest) N(soort,ev,basis,zijd,stan)",SPEC VZ LID N,,,,,,,,,,,,,,,,,,,,,,,"   ",p.1.s.1.w.2 p.1.s.1.w.3 p.1.s.1.w.4 p.1.s.1.w.5,"   ","   "
WR-P-P-G-0000226153,Riviertoerisme voor landrotten," En zo tuffen we intussen",relaxed door de bochten," van de Baïse , in",relaxed door de bocht,"ADJ(vrij,basis,zonder) VZ(init) LID(bep,stan,rest) N(soort,mv,basis)",ADJ VZ LID N,,,,,,,,,,,,,,,,,,,,,,,"   ",p.4.s.1.w.6 p.4.s.1.w.7 p.4.s.1.w.8 p.4.s.1.w.9,"   ","   "
WR-P-P-G-0000540059,4x4 van het jaar," laat zich met vertrouwen vrij",precies door de bochten," sturen . Hij gaat daarbij",precies door de bocht,"ADJ(vrij,basis,zonder) VZ(init) LID(bep,stan,rest) N(soort,mv,basis)",ADJ VZ LID N,,,,,,,,,,,,,,,,,,,,,,,"   ",p.7.s.1.w.15 p.7.s.1.w.16 p.7.s.1.w.17 p.7.s.1.w.18,"   ","   "
WR-P-P-G-0000707720,Sportieve zakelijkheid voor goedverdieners," als The Saint zijn Volvo",P1800 door de bocht," gooide , heeft de constructeur",P1800 door de bocht,"SPEC(deeleigen) VZ(init) LID(bep,stan,rest) N(soort,ev,basis,zijd,stan)",SPEC VZ LID N,,,,,,,,,,,,,,,,,,,,,,,"   ",p.2.s.1.w.9 p.2.s.1.w.10 p.2.s.1.w.11 p.2.s.1.w.12,"   ","   "
WR-P-P-G-0000459618,Jonge bestuurster sterft bij botsing op Scheldelaan," 46-jarige motorrijder tegen zeer hoge",snelheid door de bocht," gevlogen . De man reed",snelheid door de bocht,"N(soort,ev,basis,zijd,stan) VZ(init) LID(bep,stan,rest) N(soort,ev,basis,zijd,stan)",N VZ LID N,,,,,,,,,,,,,,,,,,,,,,,"   ",p.3.s.3.w.11 p.3.s.3.w.12 p.3.s.3.w.13 p.3.s.3.w.14,"   ","   "
WR-P-P-G-0000444592,Lauwe actie voor veiliger Kerkham," Sommigen gieren zelfs razendsnel en",roekeloos door de bocht," . En dat met jeugdige",roekeloos door de bocht,"ADJ(vrij,basis,zonder) VZ(init) LID(bep,stan,rest) N(soort,ev,basis,zijd,stan)",ADJ VZ LID N,,,,,,,,,,,,,,,,,,,,,,,"   ",p.4.s.3.w.6 p.4.s.3.w.7 p.4.s.3.w.8 p.4.s.3.w.9,"   ","   "
WR-P-P-G-0000036436,"Van Moorsel rijdt in Athene niet één, maar drie onderdelen"," Want ik ga niet zo",vloeiend door de bochten," . ' Over het parkoers",vloeien door de bocht,"WW(od,vrij,zonder) VZ(init) LID(bep,stan,rest) N(soort,mv,basis)",WW VZ LID N,,,,,,,,,,,,,,,,,,,,,,,"   ",p.2.s.5.w.6 p.2.s.5.w.7 p.2.s.5.w.8 p.2.s.5.w.9,"   ","   "
WR-P-P-G-0000563813,Belgian Motor Show," must voor wie graag eens",hard door de bocht," gaat . Zaterdag ( 10",hard door de bocht,"ADJ(vrij,basis,zonder) VZ(init) LID(bep,stan,rest) N(soort,ev,basis,zijd,stan)",ADJ VZ LID N,,,,,,,,,,,,,,,,,,,,,,,"   ",p.1.s.4.w.9 p.1.s.4.w.10 p.1.s.4.w.11 p.1.s.4.w.12,"   ","   "
WR-P-P-G-0000063471,Fundamenteel debat voor lege tribune," aan komt gaat de VVD",toch door de bocht," en blijkt het dualisme zijn",toch door de bocht,"BW() VZ(init) LID(bep,stan,rest) N(soort,ev,basis,zijd,stan)",BW VZ LID N,,,,,,,,,,,,,,,,,,,,,,,"   ",p.7.s.3.w.22 p.7.s.3.w.23 p.7.s.3.w.24 p.7.s.3.w.25,"   ","   "
WR-P-P-G-0000033387,Reclame voor de eeuwige jeugd Fotografe portretteert 'nieuwe ouderen'," snelt de zestiger in hoog",tempo door de bocht," . Weg met de ellende",tempo door de bocht,"N(soort,ev,basis,onz,stan) VZ(init) LID(bep,stan,rest) N(soort,ev,basis,zijd,stan)",N VZ LID N,,,,,,,,,,,,,,,,,,,,,,,"   ",p.6.s.5.w.10 p.6.s.5.w.11 p.6.s.5.w.12 p.6.s.5.w.13,"   ","   "
WR-P-P-G-0000153309,Bot Amerikaans," wat te doen . Toen",CBS door de bocht," ging had in elk geval",CBS door de bocht,"SPEC(deeleigen) VZ(init) LID(bep,stan,rest) N(soort,ev,basis,zijd,stan)",SPEC VZ LID N,,,,,,,,,,,,,,,,,,,,,,,"   ",p.11.s.3.w.2 p.11.s.3.w.3 p.11.s.3.w.4 p.11.s.3.w.5,"   ","   "
WR-P-P-G-0000368658,Tweede Weedlimitrace lokt pak volk," de elleboog . Een gewaagd",manoeuvre door de bocht," aan de Borse . We",manoeuvre door de bocht,"N(soort,ev,basis,zijd,stan) VZ(init) LID(bep,stan,rest) N(soort,ev,basis,zijd,stan)",N VZ LID N,,,,,,,,,,,,,,,,,,,,,,,"   ",p.6.s.5.w.3 p.6.s.5.w.4 p.6.s.5.w.5 p.6.s.5.w.6,"   ","   "
WR-P-P-G-0000246054,Suzuki SX4 is vooral concurrent voor monovolumes," aangedreven auto laat zich met",plezier door de bochten," leiden . Wat een verschil",plezier door de bocht,"N(soort,ev,basis,onz,stan) VZ(init) LID(bep,stan,rest) N(soort,mv,basis)",N VZ LID N,,,,,,,,,,,,,,,,,,,,,,,"   ",p.10.s.2.w.10 p.10.s.2.w.11 p.10.s.2.w.12 p.10.s.2.w.13,"   ","   "
WR-P-P-G-0000265435,Sportieve zakelijkheid," als The Saint zijn Volvo",P1800 door de bocht," gooide , heeft de Zweedse",P1800 door de bocht,"SPEC(deeleigen) VZ(init) LID(bep,stan,rest) N(soort,ev,basis,zijd,stan)",SPEC VZ LID N,,,,,,,,,,,,,,,,,,,,,,,"   ",p.1.s.1.w.9 p.1.s.1.w.10 p.1.s.1.w.11 p.1.s.1.w.12,"   ","   "
WR-P-P-G-0000146497,VS dwingen Japan tot een nieuw valutabeleid," G7 genegeerd . Japan ging",echter door de bocht," . Japan wist nog wel",echter door de bocht,"BW() VZ(init) LID(bep,stan,rest) N(soort,ev,basis,zijd,stan)",BW VZ LID N,,,,,,,,,,,,,,,,,,,,,,,"   ",p.6.s.2.w.3 p.6.s.2.w.4 p.6.s.2.w.5 p.6.s.2.w.6,"   ","   "
WR-P-P-G-0000104239,Katholiek aartsbisdom Berlijn moet ingrijpend saneren," rooms-katholieke aartsbisschop van Berlijn ,",is door de bocht," . Onder druk van zijn",zijn door de bocht,"WW(pv,tgw,ev) VZ(init) LID(bep,stan,rest) N(soort,ev,basis,zijd,stan)",WW VZ LID N,,,,,,,,,,,,,,,,,,,,,,,"   ",p.1.s.2.w.11 p.1.s.2.w.12 p.1.s.2.w.13 p.1.s.2.w.14,"   ","   "
WR-P-P-G-0000147461,Workaholic Bot kent Brussel als zijn broekzak," vasthouden . Uiteindelijk moeten we",toch door de bocht," en dan halen we niets",toch door de bocht,"BW() VZ(init) LID(bep,stan,rest) N(soort,ev,basis,zijd,stan)",BW VZ LID N,,,,,,,,,,,,,,,,,,,,,,,"   ",p.6.s.4.w.4 p.6.s.4.w.5 p.6.s.4.w.6 p.6.s.4.w.7,"   ","   "
WR-P-P-G-0000007479,"Werk, zwerfster"," oor , of met 120",kilometer door de bocht," terwijl je een e-mail typt",kilometer door de bocht,"N(soort,ev,basis,zijd,stan) VZ(fin) LID(bep,stan,rest) N(soort,ev,basis,zijd,stan)",N VZ LID N,,,,,,,,,,,,,,,,,,,,,,,"   ",p.2.s.5.w.40 p.2.s.5.w.41 p.2.s.5.w.42 p.2.s.5.w.43,"   ","   "
WR-P-P-G-0000284446,Auto over de kop," blijkbaar te snel en werd",verrast door de bocht," . De auto ging aan",verrassen door de bocht,"WW(vd,vrij,zonder) VZ(init) LID(bep,stan,rest) N(soort,ev,basis,zijd,stan)",WW VZ LID N,,,,,,,,,,,,,,,,,,,,,,,"   ",p.2.s.2.w.9 p.2.s.2.w.10 p.2.s.2.w.11 p.2.s.2.w.12,"   ","   "
WR-P-P-G-0000124928,Waddenbesluit D66-fractie valt slecht bij achterban," als groene partij , te",snel door de bocht," is gegaan . ' De",snel door de bocht,"ADJ(vrij,basis,zonder) VZ(init) LID(bep,stan,rest) N(soort,ev,basis,zijd,stan)",ADJ VZ LID N,,,,,,,,,,,,,,,,,,,,,,,"   ",p.4.s.3.w.12 p.4.s.3.w.13 p.4.s.3.w.14 p.4.s.3.w.15,"   ","   "
WR-P-P-G-0000564522,DOCU Te snel door de bocht,DOCU Te,snel door de bocht," Drie keer Formule 1-wereldkampioen ,",snel door de bocht,"ADJ(vrij,basis,zonder) VZ(init) LID(bep,stan,rest) N(soort,ev,basis,zijd,stan)",ADJ VZ LID N,,,,,,,,,,,,,,,,,,,,,,,"   ",head.1.s.1.w.3 head.1.s.1.w.4 head.1.s.1.w.5 head.1.s.1.w.6,"   ","   "
WR-P-P-G-0000227508,Vijf meter ongebreidelde luxe," kan de limousine nog bijzonder",snel door de bocht," worden gejaagd . Veiligheid ,",snel door de bocht,"ADJ(vrij,basis,zonder) VZ(init) LID(bep,stan,rest) N(soort,ev,basis,zijd,stan)",ADJ VZ LID N,,,,,,,,,,,,,,,,,,,,,,,"   ",p.7.s.9.w.10 p.7.s.9.w.11 p.7.s.9.w.12 p.7.s.9.w.13,"   ","   "
WR-P-P-G-0000150150,Met oogklep op raast Campo door de bochten,Met oogklep op raast,Campo door de bochten," Eén oogklep biedt uitkomst .",Campo door de bocht,"SPEC(vreemd) VZ(init) LID(bep,stan,rest) N(soort,mv,basis)",SPEC VZ LID N,,,,,,,,,,,,,,,,,,,,,,,"   ",head.1.s.1.w.5 head.1.s.1.w.6 head.1.s.1.w.7 head.1.s.1.w.8,"   ","   "
WR-P-P-G-0000582851,"""Schumacher is niet uitgeblust''"," . We gaan nu al",sneller door de bochten," . Omdat de motor korter",snel door de bocht,"ADJ(vrij,comp,zonder) VZ(init) LID(bep,stan,rest) N(soort,mv,basis)",ADJ VZ LID N,,,,,,,,,,,,,,,,,,,,,,,"   ",p.1.s.4.w.5 p.1.s.4.w.6 p.1.s.4.w.7 p.1.s.4.w.8,"   ","   "
WR-P-P-G-0000582851,"""Schumacher is niet uitgeblust''"," per uur kan je dus",hoekiger door de bochten," , want je riskeert toch",hoekig door de bocht,"ADJ(vrij,comp,zonder) VZ(init) LID(bep,stan,rest) N(soort,mv,basis)",ADJ VZ LID N,,,,,,,,,,,,,,,,,,,,,,,"   ",p.1.s.9.w.9 p.1.s.9.w.10 p.1.s.9.w.11 p.1.s.9.w.12,"   ","   "
WR-P-P-G-0000193548,Mario Aerts: 'Ik reed om QuickStep te doen verliezen'," snelheid . Verbrugghe ging als",eerste door de bocht," . Hij schoof weg ,",eerst door de bocht,"TW(rang,nom,zonder-n) VZ(init) LID(bep,stan,rest) N(soort,ev,basis,zijd,stan)",TW VZ LID N,,,,,,,,,,,,,,,,,,,,,,,"   ",p.4.s.4.w.4 p.4.s.4.w.5 p.4.s.4.w.6 p.4.s.4.w.7,"   ","   "
WR-P-P-G-0000522944,"Groter, sneller en luxueuzer"," bijzonder effectief , maar het",kaarsrecht door de bochten," scheuren voelt bijwijlen onnatuurlijk aan",kaarsrecht door de bocht,"ADJ(vrij,basis,zonder) VZ(init) LID(bep,stan,rest) N(soort,mv,basis)",ADJ VZ LID N,,,,,,,,,,,,,,,,,,,,,,,"   ",p.5.s.3.w.14 p.5.s.3.w.15 p.5.s.3.w.16 p.5.s.3.w.17,"   ","   "
WR-P-P-G-0000162543,Delft rouwt zonder droefheid," van marine , landmacht en",luchtmacht door de bocht," bij het gemeentehuis , daarna",luchtmacht door de bocht,"N(soort,ev,basis,zijd,stan) VZ(init) LID(bep,stan,rest) N(soort,ev,basis,zijd,stan)",N VZ LID N,,,,,,,,,,,,,,,,,,,,,,,"   ",p.13.s.4.w.10 p.13.s.4.w.11 p.13.s.4.w.12 p.13.s.4.w.13,"   ","   "
WR-P-P-G-0000558716,Nys zondag op Flying Doctors'," Dugast-tube waarmee de Kannibaal van",Baal door de bochten," zal scheuren . "" Ik",balen door de bocht,"WW(pv,tgw,ev) VZ(init) LID(bep,stan,rest) N(soort,mv,basis)",WW VZ LID N,,,,,,,,,,,,,,,,,,,,,,,"   ",p.1.s.2.w.12 p.1.s.2.w.13 p.1.s.2.w.14 p.1.s.2.w.15,"   ","   "
WR-P-P-G-0000558716,Nys zondag op Flying Doctors'," vier kilometer per uur sneller",mee door de bochten," . Dat betekent een winst",mee door de bocht,"VZ(fin) VZ(init) LID(bep,stan,rest) N(soort,mv,basis)",VZ VZ LID N,,,,,,,,,,,,,,,,,,,,,,,"   ",p.2.s.1.w.34 p.2.s.1.w.35 p.2.s.1.w.36 p.2.s.1.w.37,"   ","   "
WR-P-P-G-0000090826,Nieuwe wegenwacht is een `slim dingetje'," stuurt hij zijn Mercedes Benz",sleepwagen door de bocht," , overlegt intussen per gsm",sleepwagen door de bocht,"WW(vd,vrij,zonder) VZ(init) LID(bep,stan,rest) N(soort,ev,basis,zijd,stan)",WW VZ LID N,,,,,,,,,,,,,,,,,,,,,,,"   ",p.2.s.2.w.9 p.2.s.2.w.10 p.2.s.2.w.11 p.2.s.2.w.12,"   ","   "
WR-P-P-G-0000193689,Met de zijruit vliegen vangen," abrupt afgebroken . Wagens die",dichtbij door de bocht," scheuren overstemmen alles . Er",dichtbij door de bocht,"ADJ(vrij,basis,zonder) VZ(init) LID(bep,stan,rest) N(soort,ev,basis,zijd,stan)",ADJ VZ LID N,,,,,,,,,,,,,,,,,,,,,,,"   ",p.2.s.5.w.3 p.2.s.5.w.4 p.2.s.5.w.5 p.2.s.5.w.6,"   ","   "
WR-P-P-G-0000284381,Auto over de kop," blijkbaar te snel en werd",verrast door de bocht," . De auto ging aan",verrassen door de bocht,"WW(vd,vrij,zonder) VZ(init) LID(bep,stan,rest) N(soort,ev,basis,zijd,stan)",WW VZ LID N,,,,,,,,,,,,,,,,,,,,,,,"   ",p.2.s.2.w.9 p.2.s.2.w.10 p.2.s.2.w.11 p.2.s.2.w.12,"   ","   "
WR-P-P-H-0000135641,Richard Groenendaal {Rabobank-Giant Offroad Team} -- 'Ik moet weer ritme in mijn leven krijgen'," dat iemand na lang sukkelen",probleemloos door een bocht," vlamt , dan maakt dat",probleemloos door een bocht,"ADJ(vrij,basis,zonder) VZ(init) LID(onbep,stan,agr) N(soort,ev,basis,zijd,stan)",ADJ VZ LID N,,,,,,,,,,,,,,,,,,,,,,,"   ",p.14.s.2.w.16 p.14.s.2.w.17 p.14.s.2.w.18 p.14.s.2.w.19,"   ","   "
WR-P-P-H-0000033123,Volledig uitgerust," gaat zeer stabiel en verrassend",snel door de bochten," , maar voelt tegelijkertijd ook",snel door de bocht,"ADJ(vrij,basis,zonder) VZ(init) LID(bep,stan,rest) N(soort,mv,basis)",ADJ VZ LID N,,,,,,,,,,,,,,,,,,,,,,,"   ",p.1.s.1.w.32 p.1.s.1.w.33 p.1.s.1.w.34 p.1.s.1.w.35,"   ","   "
WR-P-P-G-0000047497,Open Tigra praktisch én leuk," iets strakker over de weg",en door de bocht," . Alleen tijdens het open",en door de bocht,"VG(neven) VZ(init) LID(bep,stan,rest) N(soort,ev,basis,zijd,stan)",VG VZ LID N,,,,,,,,,,,,,,,,,,,,,,,"   ",p.10.s.6.w.12 p.10.s.6.w.13 p.10.s.6.w.14 p.10.s.6.w.15,"   ","   "
WR-P-P-G-0000199146,De politiek van mythes en karikaturen," Jean-Luc Dehaene , die ook",brutaal door de bocht," durft scheuren , met Vilvoorde",brutaal door de bocht,"ADJ(vrij,basis,zonder) VZ(init) LID(bep,stan,rest) N(soort,ev,basis,zijd,stan)",ADJ VZ LID N,,,,,,,,,,,,,,,,,,,,,,,"   ",p.4.s.4.w.8 p.4.s.4.w.9 p.4.s.4.w.10 p.4.s.4.w.11,"   ","   "
WR-P-P-G-0000052870,Oproep: Stug of liever veercomfort?," zijn tegenwoordig stug afgeveerd om",hard door de bocht," te kunnen . Zitten automobilisten",hard door de bocht,"ADJ(vrij,basis,zonder) VZ(init) LID(bep,stan,rest) N(soort,ev,basis,zijd,stan)",ADJ VZ LID N,,,,,,,,,,,,,,,,,,,,,,,"   ",p.1.s.2.w.8 p.1.s.2.w.9 p.1.s.2.w.10 p.1.s.2.w.11,"   ","   "
WR-P-P-G-0000496083,DE TIJD," kortaf bent geweest , te",snel door de bocht," , te onmens en te",snel door de bocht,"ADJ(vrij,basis,zonder) VZ(init) LID(bep,stan,rest) N(soort,ev,basis,zijd,stan)",ADJ VZ LID N,,,,,,,,,,,,,,,,,,,,,,,"   ",p.2.s.5.w.51 p.2.s.5.w.52 p.2.s.5.w.53 p.2.s.5.w.54,"   ","   "
WR-P-P-G-0000398332,Dodenweg eist nieuw slachtoffer," het leven kwam , werd",verrast door een bocht," in de weg . Vermoedelijk",verrassen door een bocht,"WW(vd,vrij,zonder) VZ(init) LID(onbep,stan,agr) N(soort,ev,basis,zijd,stan)",WW VZ LID N,,,,,,,,,,,,,,,,,,,,,,,"   ",p.4.s.1.w.13 p.4.s.1.w.14 p.4.s.1.w.15 p.4.s.1.w.16,"   ","   "
WR-P-P-G-0000341339,Auto ramt verkeersbord," man van 20 uit Borgloon",ging door de bocht," en ramde een verkeersbord .",gaan door de bocht,"WW(pv,verl,ev) VZ(init) LID(bep,stan,rest) N(soort,ev,basis,zijd,stan)",WW VZ LID N,,,,,,,,,,,,,,,,,,,,,,,"   ",p.2.s.2.w.7 p.2.s.2.w.8 p.2.s.2.w.9 p.2.s.2.w.10,"   ","   "
WR-P-P-G-0000656426,Gevaert wil derde medaille," Olivia Borlée ( 20 )",snelt door de bocht," en Kim Gevaert ( 28",snellen door de bocht,"WW(pv,tgw,met-t) VZ(init) LID(bep,stan,rest) N(soort,ev,basis,zijd,stan)",WW VZ LID N,,,,,,,,,,,,,,,,,,,,,,,"   ",p.3.s.1.w.21 p.3.s.1.w.22 p.3.s.1.w.23 p.3.s.1.w.24,"   ","   "
WR-P-P-G-0000533919,Doodrijder is drie maanden langer rijbewijs kwijt," snelheid van 126 km /",u door de bocht," scheurde en dat hij 0,68",u door de bocht,"VNW(pers,pron,nomin,vol,2b,getal) VZ(init) LID(bep,stan,rest) N(soort,ev,basis,zijd,stan)",VNW VZ LID N,,,,,,,,,,,,,,,,,,,,,,,"   ",p.4.s.1.w.21 p.4.s.1.w.22 p.4.s.1.w.23 p.4.s.1.w.24,"   ","   "
WR-P-P-G-0000311899,Auto overkop op Gentse stadsring," een 30-jarige vrouw uit Evergem",gezwind door de bocht," en verloor de controle over",gezwind door de bocht,"ADJ(vrij,basis,zonder) VZ(init) LID(bep,stan,rest) N(soort,ev,basis,zijd,stan)",ADJ VZ LID N,,,,,,,,,,,,,,,,,,,,,,,"   ",p.2.s.1.w.10 p.2.s.1.w.11 p.2.s.1.w.12 p.2.s.1.w.13,"   ","   "
WR-P-P-G-0000654061,Gevaert en Hellebaut klaar voor goud," het voordeel dat weinigen zo",pijlsnel door de bocht," stuiven . "" Uiteraard zijn",pijlsnel door de bocht,"ADJ(vrij,basis,zonder) VZ(init) LID(bep,stan,rest) N(soort,ev,basis,zijd,stan)",ADJ VZ LID N,,,,,,,,,,,,,,,,,,,,,,,"   ",p.3.s.7.w.12 p.3.s.7.w.13 p.3.s.7.w.14 p.3.s.7.w.15,"   ","   "
WR-P-P-G-0000139483,Euro-scepsis VVD is voor bühne," moment gaat de fractie dan",mokkend door de bocht," , want men gaat het",mokken door de bocht,"WW(od,vrij,zonder) VZ(init) LID(bep,stan,rest) N(soort,ev,basis,zijd,stan)",WW VZ LID N,,,,,,,,,,,,,,,,,,,,,,,"   ",p.15.s.3.w.9 p.15.s.3.w.10 p.15.s.3.w.11 p.15.s.3.w.12,"   ","   "
WR-P-P-G-0000491343,Auto ramt betonblokken," Heernislaan ging een automobilist te",snel door de bocht," en ramde de betonblokken .",snel door de bocht,"ADJ(vrij,basis,zonder) VZ(init) LID(bep,stan,rest) N(soort,ev,basis,zijd,stan)",ADJ VZ LID N,,,,,,,,,,,,,,,,,,,,,,,"   ",p.1.s.1.w.8 p.1.s.1.w.9 p.1.s.1.w.10 p.1.s.1.w.11,"   ","   "
WR-P-P-G-0000139743,Ook snelweg met uitzicht is moordenaar," Dam ging na aanvankelijke aarzeling",eveneens door de bocht," en schreef na afloop van",eveneens door de bocht,"BW() VZ(init) LID(bep,stan,rest) N(soort,ev,basis,zijd,stan)",BW VZ LID N,,,,,,,,,,,,,,,,,,,,,,,"   ",p.5.s.2.w.10 p.5.s.2.w.11 p.5.s.2.w.12 p.5.s.2.w.13,"   ","   "
WR-P-P-G-0000309475,«Ik ga iets riskeren»," dus : snel starten ,",vlot door de bochten," en desnoods stilvallen in de",vlot door de bocht,"ADJ(vrij,basis,zonder) VZ(init) LID(bep,stan,rest) N(soort,mv,basis)",ADJ VZ LID N,,,,,,,,,,,,,,,,,,,,,,,"   ",p.4.s.11.w.8 p.4.s.11.w.9 p.4.s.11.w.10 p.4.s.11.w.11,"   ","   "
WR-P-P-G-0000532055,«Met zijn auto racen tegen TGV»," miste de vaardigheden om een",racewagen door de bochten," te sturen . Echt koersen",racewagen door de bocht,"N(soort,ev,basis,zijd,stan) VZ(init) LID(bep,stan,rest) N(soort,mv,basis)",N VZ LID N,,,,,,,,,,,,,,,,,,,,,,,"   ",p.13.s.9.w.13 p.13.s.9.w.14 p.13.s.9.w.15 p.13.s.9.w.16,"   ","   "
WR-P-P-G-0000363840,Zware straffen voor chauffeur die bij vluchtmisdrijf huis binnenknalde," ik een wagen met gierende",banden door de bocht," net voor ons huis hoor",band door de bocht,"N(soort,mv,basis) VZ(init) LID(bep,stan,rest) N(soort,ev,basis,zijd,stan)",N VZ LID N,,,,,,,,,,,,,,,,,,,,,,,"   ",p.7.s.5.w.15 p.7.s.5.w.16 p.7.s.5.w.17 p.7.s.5.w.18,"   ","   "
WR-P-P-H-0000064030,Vaatwasser voor twee kopjes," De rol wordt bij het",uitkomen door een bocht," gevoerd die als weerstand fungeert",uitkomen door een bocht,"WW(inf,nom,zonder,zonder-n) VZ(init) LID(onbep,stan,agr) N(soort,ev,basis,zijd,stan)",WW VZ LID N,,,,,,,,,,,,,,,,,,,,,,,"   ",p.5.s.4.w.6 p.5.s.4.w.7 p.5.s.4.w.8 p.5.s.4.w.9,"   ","   "
WR-U-E-A-0000104042,Unspecified," 1 ? curved ? hmms",slippen door de bochten," :p drifteeeeuuuuh nog 1 min",slippen door de bocht,"WW(pv,tgw,mv) VZ(init) LID(bep,stan,rest) N(soort,mv,basis)",WW VZ LID N,,,,,,,,,,,,,,,,,,,,,,,"   ",text.1.event.16954.s.2.w.2 text.1.event.16954.s.2.w.3 text.1.event.16954.s.2.w.4 text.1.event.16954.s.2.w.5,"   ","   "
WR-U-E-A-0000104072,Unspecified," tegen u zei KoFFiE dak",sneller door nen bocht," durf gaan dan u ;)",snel door een bocht,"ADJ(vrij,comp,zonder) VZ(init) LID(onbep,dial) N(soort,ev,basis,zijd,stan)",ADJ VZ LID N,,,,,,,,,,,,,,,,,,,,,,,"   ",text.1.event.7118.s.1.w.9 text.1.event.7118.s.1.w.10 text.1.event.7118.s.1.w.11 text.1.event.7118.s.1.w.12,"   ","   "
WS-U-E-A-0000133601,FORMULE 1 UPDATE," met Felipe Massa als eerste",vlot door de bocht," gaat , dat geldt niet",vlot door de bocht,"ADJ(vrij,basis,zonder) VZ(init) LID(bep,stan,rest) N(soort,ev,basis,zijd,stan)",ADJ VZ LID N,,,,,,,,,,,,,,,,,,,,,,,"   ",p.1.s.2.w.26 p.1.s.2.w.27 p.1.s.2.w.28 p.1.s.2.w.29,"   ","   "
