docPid,docName,left_context,context,right_context,lemma,pos,pos_head,pos_buiging,pos_conjtype,pos_dial,pos_genus,pos_getal,pos_getal_n,pos_graad,pos_lwtype,pos_naamval,pos_npagr,pos_ntype,pos_numtype,pos_pdtype,pos_persoon,pos_positie,pos_pvagr,pos_pvtijd,pos_spectype,pos_status,pos_vwtype,pos_vztype,pos_wvorm,phonetic,xmlid,begintime,endtime
WR-P-P-H-0000073081,Boeken," culinaire fantasieën . In het",boek Door de Bocht," brengen Jennifer Paterson ( recent",boek door de Bocht,"N(soort,ev,basis,onz,stan) VZ(init) LID(bep,stan,rest) SPEC(deeleigen)",N VZ LID SPEC,,,,,,,,,,,,,,,,,,,,,,,"   ",p.1.s.3.w.3 p.1.s.3.w.4 p.1.s.3.w.5 p.1.s.3.w.6,"   ","   "
WR-P-P-H-0000109105,Mercedes-Benz SL500," beweegt . Hoe vlug u",ook door de bocht," scheurt , nooit voelt u",ook door de bocht,"BW() VZ(init) LID(bep,stan,rest) N(soort,ev,basis,zijd,stan)",BW VZ LID N,,,,,,,,,,,,,,,,,,,,,,,"   ",p.5.s.7.w.4 p.5.s.7.w.5 p.5.s.7.w.6 p.5.s.7.w.7,"   ","   "
WR-P-P-H-0000131806,NIEUWE VOLVO S60Zweedse dynamiek," vertrouwen besturen en gaat hij",vlot door de bochten," . Wanneer het stuur snel",vlot door de bocht,"ADJ(vrij,basis,zonder) VZ(init) LID(bep,stan,rest) N(soort,mv,basis)",ADJ VZ LID N,,,,,,,,,,,,,,,,,,,,,,,"   ",p.3.s.4.w.21 p.3.s.4.w.22 p.3.s.4.w.23 p.3.s.4.w.24,"   ","   "
WR-P-P-H-0000080253,Op acht wielen door de bocht,Op acht,wielen door de bocht," GENK De toenemende files en",wiel door de bocht,"N(soort,mv,basis) VZ(init) LID(bep,stan,rest) N(soort,ev,basis,zijd,stan)",N VZ LID N,,,,,,,,,,,,,,,,,,,,,,,"   ",head.1.s.1.w.3 head.1.s.1.w.4 head.1.s.1.w.5 head.1.s.1.w.6,"   ","   "
WR-P-P-G-0000374127,«Ik snak naar een gewoon leven»," . Ze lachen ermee als",ze door een bocht," slippen . Oudere mannen doen",ze door een bocht,"VNW(pers,pron,stan,red,3,mv) VZ(init) LID(onbep,stan,agr) N(soort,ev,basis,zijd,stan)",VNW VZ LID N,,,,,,,,,,,,,,,,,,,,,,,"   ",p.7.s.10.w.5 p.7.s.10.w.6 p.7.s.10.w.7 p.7.s.10.w.8,"   ","   "
WR-P-P-G-0000012338,Honda CBR 600 RR € 11.988," RR gaat niet alleen ontzettend",hard door de bocht," , maar voelt ook zeer",hard door de bocht,"ADJ(vrij,basis,zonder) VZ(init) LID(bep,stan,rest) N(soort,ev,basis,zijd,stan)",ADJ VZ LID N,,,,,,,,,,,,,,,,,,,,,,,"   ",p.4.s.2.w.9 p.4.s.2.w.10 p.4.s.2.w.11 p.4.s.2.w.12,"   ","   "
WR-P-P-G-0000044966,Coach laat Bos vallen," bekend kan hij niet met",iedereen door de bocht," . '' Poltavets ( 42",iedereen door de bocht,"VNW(onbep,pron,stan,vol,3p,ev) VZ(init) LID(bep,stan,rest) N(soort,ev,basis,zijd,stan)",VNW VZ LID N,,,,,,,,,,,,,,,,,,,,,,,"   ",p.2.s.4.w.7 p.2.s.4.w.8 p.2.s.4.w.9 p.2.s.4.w.10,"   ","   "
WR-P-P-G-0000344838,Oppermachtige Alonso geeft rijles," zijn Renault bij 270 per",uur door een bocht," stuurde . Ook al zijn",uur door een bocht,"N(soort,ev,basis,onz,stan) VZ(init) LID(onbep,stan,agr) N(soort,ev,basis,zijd,stan)",N VZ LID N,,,,,,,,,,,,,,,,,,,,,,,"   ",p.6.s.11.w.8 p.6.s.11.w.9 p.6.s.11.w.10 p.6.s.11.w.11,"   ","   "
WR-P-P-G-0000708967,Snelheidslimiet moet racers afremmen," met de motor of de",auto door de bochten," scheurden "" , zegt Ivan",auto door de bocht,"N(soort,ev,basis,zijd,stan) VZ(init) LID(bep,stan,rest) N(soort,mv,basis)",N VZ LID N,,,,,,,,,,,,,,,,,,,,,,,"   ",p.3.s.1.w.22 p.3.s.1.w.23 p.3.s.1.w.24 p.3.s.1.w.25,"   ","   "
WR-P-P-G-0000192028,Sociale partners niet opgezet met plannen voor eenheidspensioen," je met dit idee nog",net door de bocht," . Maar de historiek en",net door de bocht,"BW() VZ(init) LID(bep,stan,rest) N(soort,ev,basis,zijd,stan)",BW VZ LID N,,,,,,,,,,,,,,,,,,,,,,,"   ",p.4.s.3.w.10 p.4.s.3.w.11 p.4.s.3.w.12 p.4.s.3.w.13,"   ","   "
WR-P-P-G-0000705887,"""Ik had even geen zin"," nooit in het veld .",Vol door de bochten," gaan deed ik bijvoorbeeld nog",vol door de bocht,"ADJ(vrij,basis,zonder) VZ(init) LID(bep,stan,rest) N(soort,mv,basis)",ADJ VZ LID N,,,,,,,,,,,,,,,,,,,,,,,"   ",p.6.s.5.w.1 p.6.s.5.w.2 p.6.s.5.w.3 p.6.s.5.w.4,"   ","   "
WR-P-P-G-0000124642,Tenslotte leek alles geoorloofd," spanning of het ' Comité",' door de bocht," gaat en de kerk heel",' door de bocht,"LET() VZ(init) LID(bep,stan,rest) N(soort,ev,basis,zijd,stan)",LET VZ LID N,,,,,,,,,,,,,,,,,,,,,,,"   ",p.3.s.2.w.10 p.3.s.2.w.11 p.3.s.2.w.12 p.3.s.2.w.13,"   ","   "
WR-P-P-G-0000236241,Groeien voor de veiligheid," rijstijl omdat het autootje zich",gezwind door de bochten," laat jagen . Daarbij deden",gezwind door de bocht,"ADJ(vrij,basis,zonder) VZ(init) LID(bep,stan,rest) N(soort,mv,basis)",ADJ VZ LID N,,,,,,,,,,,,,,,,,,,,,,,"   ",p.5.s.3.w.15 p.5.s.3.w.16 p.5.s.3.w.17 p.5.s.3.w.18,"   ","   "
WR-P-P-G-0000044949,Arendsoog is terug," kan ook bij Feyenoord met",iedereen door de bocht," . '' Horloge In de",iedereen door de bocht,"VNW(onbep,pron,stan,vol,3p,ev) VZ(init) LID(bep,stan,rest) N(soort,ev,basis,zijd,stan)",VNW VZ LID N,,,,,,,,,,,,,,,,,,,,,,,"   ",p.21.s.5.w.7 p.21.s.5.w.8 p.21.s.5.w.9 p.21.s.5.w.10,"   ","   "
WR-P-P-G-0000148477,Laat Kamers de Europese grondwet goedkeuren," al beslist . De VVD",is door de bocht," , waarmee de wet verzekerd",zijn door de bocht,"WW(pv,tgw,ev) VZ(init) LID(bep,stan,rest) N(soort,ev,basis,zijd,stan)",WW VZ LID N,,,,,,,,,,,,,,,,,,,,,,,"   ",p.2.s.2.w.3 p.2.s.2.w.4 p.2.s.2.w.5 p.2.s.2.w.6,"   ","   "
WR-P-P-G-0000105871,Akkoord redt platteland," genoeg gaan onterecht . Europa",is door de bocht," en veranderingen komen stapje voor",zijn door de bocht,"WW(pv,tgw,ev) VZ(init) LID(bep,stan,rest) N(soort,ev,basis,zijd,stan)",WW VZ LID N,,,,,,,,,,,,,,,,,,,,,,,"   ",p.7.s.2.w.2 p.7.s.2.w.3 p.7.s.2.w.4 p.7.s.2.w.5,"   ","   "
WR-P-P-G-0000457693,Snelheidsduivel Tanja Dexters IS rijbewijs 15 DAGEN kwijt," gebouwen springen , met haar",motor door de bochten," scheuren , maar ook van",motor door de bocht,"N(soort,ev,basis,zijd,stan) VZ(init) LID(bep,stan,rest) N(soort,mv,basis)",N VZ LID N,,,,,,,,,,,,,,,,,,,,,,,"   ",p.1.s.2.w.8 p.1.s.2.w.9 p.1.s.2.w.10 p.1.s.2.w.11,"   ","   "
WR-P-P-G-0000016073,Droom Capirossi komt snel uit," waagden het niet op volle",snelheid door de bochten," te jakkeren , uit vrees",snelheid door de bocht,"N(soort,ev,basis,zijd,stan) VZ(init) LID(bep,stan,rest) N(soort,mv,basis)",N VZ LID N,,,,,,,,,,,,,,,,,,,,,,,"   ",p.5.s.1.w.8 p.5.s.1.w.9 p.5.s.1.w.10 p.5.s.1.w.11,"   ","   "
WR-P-P-G-0000183771,Pijpen in overdrive," een animatiefilmpje waarin een rood",autootje door de bochten," scheurt op weg naar het",auto door de bocht,"N(soort,ev,dim,onz,stan) VZ(init) LID(bep,stan,rest) N(soort,mv,basis)",N VZ LID N,,,,,,,,,,,,,,,,,,,,,,,"   ",p.4.s.3.w.11 p.4.s.3.w.12 p.4.s.3.w.13 p.4.s.3.w.14,"   ","   "
WR-P-P-G-0000034321,Nog sterker de woestijn in," het stuur gooit hij de",vrachtwagen door de bocht," alsof het een speelgoedautootje is",vrachtwagen door de bocht,"N(soort,ev,basis,zijd,stan) VZ(init) LID(bep,stan,rest) N(soort,ev,basis,zijd,stan)",N VZ LID N,,,,,,,,,,,,,,,,,,,,,,,"   ",p.1.s.2.w.11 p.1.s.2.w.12 p.1.s.2.w.13 p.1.s.2.w.14,"   ","   "
WR-P-P-G-0000588460,Monsters & beauty's," waarmee ook prins Laurent wel",eens door de bochten," scheurt . De meeste wagens",eens door de bocht,"BW() VZ(init) LID(bep,stan,rest) N(soort,mv,basis)",BW VZ LID N,,,,,,,,,,,,,,,,,,,,,,,"   ",p.2.s.2.w.35 p.2.s.2.w.36 p.2.s.2.w.37 p.2.s.2.w.38,"   ","   "
WR-P-P-G-0000651968,Suzuki SX4 vooral concurrent voor monovolumes," aangedreven auto laat zich met",plezier door de bochten," leiden . Wat een verschil",plezier door de bocht,"N(soort,ev,basis,onz,stan) VZ(init) LID(bep,stan,rest) N(soort,mv,basis)",N VZ LID N,,,,,,,,,,,,,,,,,,,,,,,"   ",p.6.s.5.w.10 p.6.s.5.w.11 p.6.s.5.w.12 p.6.s.5.w.13,"   ","   "
WR-P-P-G-0000070873,De Letse huiver voor de EU," en die gingen stuk voor",stuk door de bocht," . In Letland blies het",stuk door de bocht,"N(soort,ev,basis,onz,stan) VZ(init) LID(bep,stan,rest) N(soort,ev,basis,zijd,stan)",N VZ LID N,,,,,,,,,,,,,,,,,,,,,,,"   ",p.6.s.1.w.20 p.6.s.1.w.21 p.6.s.1.w.22 p.6.s.1.w.23,"   ","   "
WR-P-P-G-0000154421,Taiwan tart Chinese leiders met nieuwe referendumwet," en de Volk Eerst Partij",uiteindelijk door de bocht," . Om te voorkomen dat",uiteindelijk door de bocht,"ADJ(vrij,basis,zonder) VZ(init) LID(bep,stan,rest) N(soort,ev,basis,zijd,stan)",ADJ VZ LID N,,,,,,,,,,,,,,,,,,,,,,,"   ",p.4.s.2.w.18 p.4.s.2.w.19 p.4.s.2.w.20 p.4.s.2.w.21,"   ","   "
WR-P-P-G-0000623664,Even snedig maar vooral," omdat het autootje zich zo",gezwind door de bochten," laat jagen . Daarbij deden",gezwind door de bocht,"ADJ(vrij,basis,zonder) VZ(init) LID(bep,stan,rest) N(soort,mv,basis)",ADJ VZ LID N,,,,,,,,,,,,,,,,,,,,,,,"   ",p.5.s.2.w.16 p.5.s.2.w.17 p.5.s.2.w.18 p.5.s.2.w.19,"   ","   "
WR-P-P-G-0000298562,Hip op wieltjes," extra gladde zijkant om nog",sneller door de bochten," te vliegen - Harry Beaver",snel door de bocht,"ADJ(vrij,comp,zonder) VZ(init) LID(bep,stan,rest) N(soort,mv,basis)",ADJ VZ LID N,,,,,,,,,,,,,,,,,,,,,,,"   ",p.3.s.1.w.20 p.3.s.1.w.21 p.3.s.1.w.22 p.3.s.1.w.23,"   ","   "
WR-P-P-G-0000656166,Honda PS 125i lacht met files en stadsverkeer," gaat graag en zonder slingeren",volgas door de bochten," . Hij houdt ook het",volgas door de bocht,"N(soort,ev,basis,onz,stan) VZ(init) LID(bep,stan,rest) N(soort,mv,basis)",N VZ LID N,,,,,,,,,,,,,,,,,,,,,,,"   ",p.6.s.2.w.10 p.6.s.2.w.11 p.6.s.2.w.12 p.6.s.2.w.13,"   ","   "
WR-P-P-G-0000281787,Dynamische luxe kost fortuin," , maar de auto rolt",minder door de bocht," en weet nog beter zijn",minder door de bocht,"VNW(onbep,grad,stan,vrij,zonder,comp) VZ(init) LID(bep,stan,rest) N(soort,ev,basis,zijd,stan)",VNW VZ LID N,,,,,,,,,,,,,,,,,,,,,,,"   ",p.5.s.2.w.13 p.5.s.2.w.14 p.5.s.2.w.15 p.5.s.2.w.16,"   ","   "
WR-P-P-G-0000218762,Bestuurder krijgt zwaardere straf," Over de snelheid waartegen de",bestuurder door de bocht," ging , liepen de meningen",bestuurder door de bocht,"N(soort,ev,basis,zijd,stan) VZ(init) LID(bep,stan,rest) N(soort,ev,basis,zijd,stan)",N VZ LID N,,,,,,,,,,,,,,,,,,,,,,,"   ",p.6.s.1.w.6 p.6.s.1.w.7 p.6.s.1.w.8 p.6.s.1.w.9,"   ","   "
WR-P-P-G-0000008040,Concessie Uefa en Fifa over transfers," Blatter gaf toe dat de",voetbalofficials door de bocht," zijn . ,, Het is",voetbalofficial door de bocht,"N(soort,mv,basis) VZ(init) LID(bep,stan,rest) N(soort,ev,basis,zijd,stan)",N VZ LID N,,,,,,,,,,,,,,,,,,,,,,,"   ",p.4.s.1.w.6 p.4.s.1.w.7 p.4.s.1.w.8 p.4.s.1.w.9,"   ","   "
WR-P-P-G-0000125313,Uitstel in EU is geen afstel," . Want waarom zou een",minister door de bocht," gaan op een voor zijn",minister door de bocht,"N(soort,ev,basis,zijd,stan) VZ(init) LID(bep,stan,rest) N(soort,ev,basis,zijd,stan)",N VZ LID N,,,,,,,,,,,,,,,,,,,,,,,"   ",p.3.s.1.w.5 p.3.s.1.w.6 p.3.s.1.w.7 p.3.s.1.w.8,"   ","   "
WR-P-P-G-0000640376,"""Ik was nooit sterker''"," tevreden over de manier waarop",ik door de bochten," ging : daar heb ik",ik door de bocht,"VNW(pers,pron,nomin,vol,1,ev) VZ(init) LID(bep,stan,rest) N(soort,mv,basis)",VNW VZ LID N,,,,,,,,,,,,,,,,,,,,,,,"   ",p.8.s.2.w.10 p.8.s.2.w.11 p.8.s.2.w.12 p.8.s.2.w.13,"   ","   "
WR-P-P-G-0000330259,Jan Van Den Bossche mag deelnemen aan Bol d'Or Classic," grindbak . Ik ging lekker",plat door de bocht," , maar de motor had",plat door de bocht,"ADJ(vrij,basis,zonder) VZ(init) LID(bep,stan,rest) N(soort,ev,basis,zijd,stan)",ADJ VZ LID N,,,,,,,,,,,,,,,,,,,,,,,"   ",p.6.s.9.w.4 p.6.s.9.w.5 p.6.s.9.w.6 p.6.s.9.w.7,"   ","   "
WR-P-P-G-0000469544,Treinreis naar Brussel duurt kwartier korter," een kwartier in tijd dalen",. Door de bocht," moeten treinen naar Brussel niet",. door de bocht,"LET() VZ(init) LID(bep,stan,rest) N(soort,ev,basis,zijd,stan)",LET VZ LID N,,,,,,,,,,,,,,,,,,,,,,,"   ",p.2.s.3.w.12 p.3.s.1.w.1 p.3.s.1.w.2 p.3.s.1.w.3,"   ","   "
WR-P-P-G-0000316559,«Dit is het bewijs dat conditie dik in orde is»," los . Ik kwam als",eerste door de bocht," , vertelt Vereecken . Dat",eerst door de bocht,"TW(rang,nom,zonder-n) VZ(init) LID(bep,stan,rest) N(soort,ev,basis,zijd,stan)",TW VZ LID N,,,,,,,,,,,,,,,,,,,,,,,"   ",p.6.s.1.w.4 p.6.s.1.w.5 p.6.s.1.w.6 p.6.s.1.w.7,"   ","   "
WR-P-P-G-0000582633,Matthé Pronk trotseert pokkenweer," Hovelijnck sneed anders wel ontzettend",hard door de bochten," , bewierookte onze Noorderbuur zijn",hard door de bocht,"ADJ(vrij,basis,zonder) VZ(init) LID(bep,stan,rest) N(soort,mv,basis)",ADJ VZ LID N,,,,,,,,,,,,,,,,,,,,,,,"   ",p.3.s.1.w.9 p.3.s.1.w.10 p.3.s.1.w.11 p.3.s.1.w.12,"   ","   "
WR-P-P-G-0000126506,"Vliegangst is onzin, alleen in de lift reis je veiliger. Waarom zijn veel mensen dan toch zo bang in de lucht?"," negatieve ervaringen hebben opgedaan ,",sneller door de bocht," . Mensen die een luchtvaartramp",snel door de bocht,"ADJ(vrij,comp,zonder) VZ(init) LID(bep,stan,rest) N(soort,ev,basis,zijd,stan)",ADJ VZ LID N,,,,,,,,,,,,,,,,,,,,,,,"   ",p.11.s.3.w.15 p.11.s.3.w.16 p.11.s.3.w.17 p.11.s.3.w.18,"   ","   "
WR-P-P-G-0000334737,Vrachtwagen verliest bakstenen," , vermoedelijk omdat hij te",snel door de bocht," was gereden . De brandweer",snel door de bocht,"ADJ(vrij,basis,zonder) VZ(init) LID(bep,stan,rest) N(soort,ev,basis,zijd,stan)",ADJ VZ LID N,,,,,,,,,,,,,,,,,,,,,,,"   ",p.1.s.2.w.12 p.1.s.2.w.13 p.1.s.2.w.14 p.1.s.2.w.15,"   ","   "
WR-P-P-G-0000009204,Historicus Levien," gejuich los : de renners",vlogen door de bocht," , de Cauberg op .",vliegen door de bocht,"WW(pv,verl,mv) VZ(init) LID(bep,stan,rest) N(soort,ev,basis,zijd,stan)",WW VZ LID N,,,,,,,,,,,,,,,,,,,,,,,"   ",p.3.s.15.w.9 p.3.s.15.w.10 p.3.s.15.w.11 p.3.s.15.w.12,"   ","   "
WR-P-P-G-0000678735,Op maat van de Europese supersportwagens," maar de Z06 laat zich",moeiteloos door de bochten," jagen , weliswaar met de",moeiteloos door de bocht,"ADJ(vrij,basis,zonder) VZ(init) LID(bep,stan,rest) N(soort,mv,basis)",ADJ VZ LID N,,,,,,,,,,,,,,,,,,,,,,,"   ",p.8.s.5.w.18 p.8.s.5.w.19 p.8.s.5.w.20 p.8.s.5.w.21,"   ","   "
WR-P-P-G-0000338336,Auto door de bocht,,Auto door de bocht," Maaseik Bij de politie werd",auto door de bocht,"N(soort,ev,basis,zijd,stan) VZ(init) LID(bep,stan,rest) N(soort,ev,basis,zijd,stan)",N VZ LID N,,,,,,,,,,,,,,,,,,,,,,,"   ",head.1.s.1.w.1 head.1.s.1.w.2 head.1.s.1.w.3 head.1.s.1.w.4,"   ","   "
WR-P-P-G-0000154262,Hoogervorst weigert geld fysiotherapie," Kamer wil dat Hoogervorst vandaag",alsnog door de bocht," gaat en de benodigde 77",alsnog door de bocht,"BW() VZ(init) LID(bep,stan,rest) N(soort,ev,basis,zijd,stan)",BW VZ LID N,,,,,,,,,,,,,,,,,,,,,,,"   ",p.2.s.1.w.11 p.2.s.1.w.12 p.2.s.1.w.13 p.2.s.1.w.14,"   ","   "
WR-P-P-G-0000488977,«Ze scheuren hier als gekken door de bocht»,Ze scheuren hier als,gekken door de bocht," Dilsen-Stokkem Een woning in de",gek door de bocht,"N(soort,mv,basis) VZ(init) LID(bep,stan,rest) N(soort,ev,basis,zijd,stan)",N VZ LID N,,,,,,,,,,,,,,,,,,,,,,,"   ",head.1.s.1.w.5 head.1.s.1.w.6 head.1.s.1.w.7 head.1.s.1.w.8,"   ","   "
WR-P-P-G-0000012451,Peugeot 206 RC ingetogen en toch uitbundig," of blozen laat hij zich",moeiteloos door de bochten," dirigeren , gesteund door een",moeiteloos door de bocht,"ADJ(vrij,basis,zonder) VZ(init) LID(bep,stan,rest) N(soort,mv,basis)",ADJ VZ LID N,,,,,,,,,,,,,,,,,,,,,,,"   ",p.4.s.2.w.8 p.4.s.2.w.9 p.4.s.2.w.10 p.4.s.2.w.11,"   ","   "
WR-P-P-G-0000381455,«Ik ben eindelijk weer gezond»," gaat een derny nu eenmaal",sneller door een bocht," dan de renner . Deze",snel door een bocht,"ADJ(vrij,comp,zonder) VZ(init) LID(onbep,stan,agr) N(soort,ev,basis,zijd,stan)",ADJ VZ LID N,,,,,,,,,,,,,,,,,,,,,,,"   ",p.4.s.4.w.8 p.4.s.4.w.9 p.4.s.4.w.10 p.4.s.4.w.11,"   ","   "
WR-P-P-G-0000247267,Op zoek naar eerste goud voor Belgische atlete," het voordeel dat weinigen zo",pijlsnel door de bocht," stuiven . "" Uiteraard zijn",pijlsnel door de bocht,"ADJ(vrij,basis,zonder) VZ(init) LID(bep,stan,rest) N(soort,ev,basis,zijd,stan)",ADJ VZ LID N,,,,,,,,,,,,,,,,,,,,,,,"   ",p.4.s.7.w.12 p.4.s.7.w.13 p.4.s.7.w.14 p.4.s.7.w.15,"   ","   "
WR-P-P-G-0000077378,Zonder achterbank," een ingenieus kantelmechanisme : hoe",harder door de bocht," , hoe meer de voorkant",hard door de bocht,"ADJ(vrij,comp,zonder) VZ(init) LID(bep,stan,rest) N(soort,ev,basis,zijd,stan)",ADJ VZ LID N,,,,,,,,,,,,,,,,,,,,,,,"   ",p.21.s.3.w.33 p.21.s.3.w.34 p.21.s.3.w.35 p.21.s.3.w.36,"   ","   "
WR-P-P-G-0000167251,Coach Van Basten laat het stormen in Zeist," niet altijd even makkelijk met",elkaar door de bocht," kunnen . Daarbij komt dat",elkaar door de bocht,"VNW(recip,pron,obl,vol,persoon,mv) VZ(init) LID(bep,stan,rest) N(soort,ev,basis,zijd,stan)",VNW VZ LID N,,,,,,,,,,,,,,,,,,,,,,,"   ",p.9.s.2.w.12 p.9.s.2.w.13 p.9.s.2.w.14 p.9.s.2.w.15,"   ","   "
WR-P-P-G-0000199298,No title available.," niet gegeven tegen 250km per",uur door een bocht," te scheuren . De gedachte",uur door een bocht,"N(soort,ev,basis,onz,stan) VZ(init) LID(onbep,stan,agr) N(soort,ev,basis,zijd,stan)",N VZ LID N,,,,,,,,,,,,,,,,,,,,,,,"   ",p.5.s.2.w.12 p.5.s.2.w.13 p.5.s.2.w.14 p.5.s.2.w.15,"   ","   "
WR-P-P-G-0000172075,No title available.," hebben ze de neiging om",scherper door de bocht," te gaan dan de voorgaande",scherp door de bocht,"ADJ(vrij,comp,zonder) VZ(init) LID(bep,stan,rest) N(soort,ev,basis,zijd,stan)",ADJ VZ LID N,,,,,,,,,,,,,,,,,,,,,,,"   ",p.15.s.5.w.23 p.15.s.5.w.24 p.15.s.5.w.25 p.15.s.5.w.26,"   ","   "
WR-P-P-G-0000114426,Vorig kabinet fel tegen vierdaagse schoolweek," . Een jaar daarop ging",Adelmund door de bocht," : de kleutergroepen mochten van",Adelmund door de bocht,"SPEC(deeleigen) VZ(init) LID(bep,stan,rest) N(soort,ev,basis,zijd,stan)",SPEC VZ LID N,,,,,,,,,,,,,,,,,,,,,,,"   ",p.3.s.1.w.5 p.3.s.1.w.6 p.3.s.1.w.7 p.3.s.1.w.8,"   ","   "
WR-P-P-G-0000157076,Fransman bederft Oostenrijkse skifuif," briljant . Hij ging zo",mooi door de bochten," . Hij verdiende deze zege",mooi door de bocht,"ADJ(vrij,basis,zonder) VZ(init) LID(bep,stan,rest) N(soort,mv,basis)",ADJ VZ LID N,,,,,,,,,,,,,,,,,,,,,,,"   ",p.2.s.3.w.4 p.2.s.3.w.5 p.2.s.3.w.6 p.2.s.3.w.7,"   ","   "
WR-P-P-G-0000356296,«Volgend jaar nog spectaculairder»," wat voor een snelheid die",kerels door de bochten," scheurden . Bovendien verzorgden zij",kerel door de bocht,"N(soort,mv,basis) VZ(init) LID(bep,stan,rest) N(soort,mv,basis)",N VZ LID N,,,,,,,,,,,,,,,,,,,,,,,"   ",p.7.s.6.w.15 p.7.s.6.w.16 p.7.s.6.w.17 p.7.s.6.w.18,"   ","   "
WR-P-P-G-0000517394,Streaker op de baan," liet z'n broek zakken en",rende door de bocht," in blote kont . Daar",rennen door de bocht,"WW(pv,verl,ev) VZ(init) LID(bep,stan,rest) N(soort,ev,basis,zijd,stan)",WW VZ LID N,,,,,,,,,,,,,,,,,,,,,,,"   ",p.1.s.3.w.8 p.1.s.3.w.9 p.1.s.3.w.10 p.1.s.3.w.11,"   ","   "
WR-P-P-G-0000163677,Het laatste palingmaal komt eraan," vorig jaar ging de Europese",Commissie door de bocht," . Er zou écht iets",commissie door de bocht,"N(soort,ev,basis,zijd,stan) VZ(init) LID(bep,stan,rest) N(soort,ev,basis,zijd,stan)",N VZ LID N,,,,,,,,,,,,,,,,,,,,,,,"   ",p.10.s.5.w.7 p.10.s.5.w.8 p.10.s.5.w.9 p.10.s.5.w.10,"   ","   "
WR-P-P-G-0000346209,«Gevaarlijke bocht moet beter aangeduid worden»," reeks ongevallen en dat kan",enkel door de bocht," beter aan te duiden .",enkel door de bocht,"BW() VZ(init) LID(bep,stan,rest) N(soort,ev,basis,zijd,stan)",BW VZ LID N,,,,,,,,,,,,,,,,,,,,,,,"   ",p.5.s.2.w.13 p.5.s.2.w.14 p.5.s.2.w.15 p.5.s.2.w.16,"   ","   "
WR-P-P-G-0000018304,De luchtmacht dreigt zijn hart te verliezen," is toch snel reageren .",Snel door de bocht," , heel snel de lucht",snel door de bocht,"ADJ(vrij,basis,zonder) VZ(init) LID(bep,stan,rest) N(soort,ev,basis,zijd,stan)",ADJ VZ LID N,,,,,,,,,,,,,,,,,,,,,,,"   ",p.7.s.4.w.1 p.7.s.4.w.2 p.7.s.4.w.3 p.7.s.4.w.4,"   ","   "
WR-P-P-G-0000491764,«Wondelgemkaai is echt racecircuit»," kwamen twee wagens tegen hoge",snelheid door de bocht," . Eén van hen reed",snelheid door de bocht,"N(soort,ev,basis,zijd,stan) VZ(init) LID(bep,stan,rest) N(soort,ev,basis,zijd,stan)",N VZ LID N,,,,,,,,,,,,,,,,,,,,,,,"   ",p.4.s.3.w.7 p.4.s.3.w.8 p.4.s.3.w.9 p.4.s.3.w.10,"   ","   "
WR-P-P-G-0000398349,Dodenweg eist nieuw slachtoffer," het leven kwam , werd",verrast door een bocht," in de weg . Vermoedelijk",verrassen door een bocht,"WW(vd,vrij,zonder) VZ(init) LID(onbep,stan,agr) N(soort,ev,basis,zijd,stan)",WW VZ LID N,,,,,,,,,,,,,,,,,,,,,,,"   ",p.4.s.1.w.13 p.4.s.1.w.14 p.4.s.1.w.15 p.4.s.1.w.16,"   ","   "
WR-P-P-G-0000261455,Hattrick Sven Nys op Koppenberg," Niet superieur bergop , wat",gereserveerd door de bochten," , af en toe slippend",reserveren door de bocht,"WW(vd,vrij,zonder) VZ(init) LID(bep,stan,rest) N(soort,mv,basis)",WW VZ LID N,,,,,,,,,,,,,,,,,,,,,,,"   ",p.1.s.7.w.6 p.1.s.7.w.7 p.1.s.7.w.8 p.1.s.7.w.9,"   ","   "
WR-P-P-G-0000167038,Zij die vallen," . Zie hoe dapper de",mannen door de bocht," heen zeilen - zie ze",man door de bocht,"N(soort,mv,basis) VZ(init) LID(bep,stan,rest) N(soort,ev,basis,zijd,stan)",N VZ LID N,,,,,,,,,,,,,,,,,,,,,,,"   ",p.15.s.1.w.5 p.15.s.1.w.6 p.15.s.1.w.7 p.15.s.1.w.8,"   ","   "
WR-P-P-G-0000293692,Jongeman zwaargewond na knal tegen vrachtwagen," hij op de Zuidlaan te",snel door een bocht," ging . Hij kon zijn",snel door een bocht,"ADJ(vrij,basis,zonder) VZ(init) LID(onbep,stan,agr) N(soort,ev,basis,zijd,stan)",ADJ VZ LID N,,,,,,,,,,,,,,,,,,,,,,,"   ",p.1.s.3.w.17 p.1.s.3.w.18 p.1.s.3.w.19 p.1.s.3.w.20,"   ","   "
WR-P-P-G-0000071120,Achtbaan vervangt mes," passagiers met 130 kilometer per",uur door de bochten," gaan , bleken net zo",uur door de bocht,"N(soort,ev,basis,onz,stan) VZ(init) LID(bep,stan,rest) N(soort,mv,basis)",N VZ LID N,,,,,,,,,,,,,,,,,,,,,,,"   ",p.3.s.5.w.28 p.3.s.5.w.29 p.3.s.5.w.30 p.3.s.5.w.31,"   ","   "
WR-P-P-G-0000650556,Suzuki SX4 vooral concurrent voor monovolumes," aangedreven auto laat zich met",plezier door de bochten," leiden . Wat een verschil",plezier door de bocht,"N(soort,ev,basis,onz,stan) VZ(init) LID(bep,stan,rest) N(soort,mv,basis)",N VZ LID N,,,,,,,,,,,,,,,,,,,,,,,"   ",p.6.s.5.w.10 p.6.s.5.w.11 p.6.s.5.w.12 p.6.s.5.w.13,"   ","   "
WR-P-P-G-0000505746,Takelaar op nippertje ontsnapt aan dood," niet aan of worden ze",verrast door de bocht," . Het is al de",verrassen door de bocht,"WW(vd,vrij,zonder) VZ(init) LID(bep,stan,rest) N(soort,ev,basis,zijd,stan)",WW VZ LID N,,,,,,,,,,,,,,,,,,,,,,,"   ",p.6.s.1.w.13 p.6.s.1.w.14 p.6.s.1.w.15 p.6.s.1.w.16,"   ","   "
WR-P-P-G-0000003200,Autocrimineel.nl," vlak : snel optrekken ,",hard door de bochten," , hard afremmen en zo",hard door de bocht,"ADJ(vrij,basis,zonder) VZ(init) LID(bep,stan,rest) N(soort,mv,basis)",ADJ VZ LID N,,,,,,,,,,,,,,,,,,,,,,,"   ",p.1.s.2.w.28 p.1.s.2.w.29 p.1.s.2.w.30 p.1.s.2.w.31,"   ","   "
WR-P-P-G-0000561362,"""Nu kan ik niet meer verliezen"," halen . "" Ze liep",beter door de bochten," . Ik moest telkens wat",goed door de bocht,"ADJ(vrij,comp,zonder) VZ(init) LID(bep,stan,rest) N(soort,mv,basis)",ADJ VZ LID N,,,,,,,,,,,,,,,,,,,,,,,"   ",p.3.s.1.w.4 p.3.s.1.w.5 p.3.s.1.w.6 p.3.s.1.w.7,"   ","   "
WR-P-P-G-0000223535,"""Honda wordt de revelatie''"," . We gaan nu al",sneller door de bochten," . Omdat de motor korter",snel door de bocht,"ADJ(vrij,comp,zonder) VZ(init) LID(bep,stan,rest) N(soort,mv,basis)",ADJ VZ LID N,,,,,,,,,,,,,,,,,,,,,,,"   ",p.6.s.4.w.5 p.6.s.4.w.6 p.6.s.4.w.7 p.6.s.4.w.8,"   ","   "
WR-P-P-G-0000223535,"""Honda wordt de revelatie''"," per uur kan je dus",hoekiger door de bochten," , want je riskeert toch",hoekig door de bocht,"ADJ(vrij,comp,zonder) VZ(init) LID(bep,stan,rest) N(soort,mv,basis)",ADJ VZ LID N,,,,,,,,,,,,,,,,,,,,,,,"   ",p.6.s.9.w.9 p.6.s.9.w.10 p.6.s.9.w.11 p.6.s.9.w.12,"   ","   "
WR-P-P-G-0000168042,Bestuurlijke vernieuwing," opliepen . Uiteindelijk moest hij",toch door de bocht," . Dat doet hij dus",toch door de bocht,"BW() VZ(init) LID(bep,stan,rest) N(soort,ev,basis,zijd,stan)",BW VZ LID N,,,,,,,,,,,,,,,,,,,,,,,"   ",p.5.s.10.w.4 p.5.s.10.w.5 p.5.s.10.w.6 p.5.s.10.w.7,"   ","   "
WR-P-P-G-0000061378,Mina Bakgraag (2)," : "" Daar komt Mina",Bakgraag door de bocht," , roer 'm om Mina",Bakgraag door de bocht,"SPEC(deeleigen) VZ(init) LID(bep,stan,rest) N(soort,ev,basis,zijd,stan)",SPEC VZ LID N,,,,,,,,,,,,,,,,,,,,,,,"   ",p.6.s.5.w.18 p.6.s.5.w.19 p.6.s.5.w.20 p.6.s.5.w.21,"   ","   "
WR-P-P-G-0000014012,Verjongingskuur voor Alfa-duo," deze GTV / Spider stuurt",vlijmscherp door de bocht," , zonder nukken te vertonen",vlijmscherp door de bocht,"ADJ(postnom,basis,zonder) VZ(init) LID(bep,stan,rest) N(soort,ev,basis,zijd,stan)",ADJ VZ LID N,,,,,,,,,,,,,,,,,,,,,,,"   ",p.3.s.3.w.7 p.3.s.3.w.8 p.3.s.3.w.9 p.3.s.3.w.10,"   ","   "
WR-P-P-G-0000489316,«Ze scheuren hier als gekken door de bocht»,Ze scheuren hier als,gekken door de bocht," Dilsen-Stokkem Een woning in de",gek door de bocht,"N(soort,mv,basis) VZ(init) LID(bep,stan,rest) N(soort,ev,basis,zijd,stan)",N VZ LID N,,,,,,,,,,,,,,,,,,,,,,,"   ",head.1.s.1.w.5 head.1.s.1.w.6 head.1.s.1.w.7 head.1.s.1.w.8,"   ","   "
WR-P-P-G-0000455520,«Onze straat ligt vol putten»," borduur omdat de chauffeurs maar",net door de bocht," geraken . Als dat gebeurt",net door de bocht,"BW() VZ(init) LID(bep,stan,rest) N(soort,ev,basis,zijd,stan)",BW VZ LID N,,,,,,,,,,,,,,,,,,,,,,,"   ",p.4.s.6.w.19 p.4.s.6.w.20 p.4.s.6.w.21 p.4.s.6.w.22,"   ","   "
WR-P-P-G-0000110217,Miljoenenspel," spelen . Maar CBS ging",snel door de bocht," . Garrett kreeg een niet",snel door de bocht,"ADJ(vrij,basis,zonder) VZ(init) LID(bep,stan,rest) N(soort,ev,basis,zijd,stan)",ADJ VZ LID N,,,,,,,,,,,,,,,,,,,,,,,"   ",p.9.s.2.w.4 p.9.s.2.w.5 p.9.s.2.w.6 p.9.s.2.w.7,"   ","   "
WR-P-P-G-0000303656,Minister Renaat Landuyt opent eerste tuningsalon in beurshal," Enkelingen scheuren inderdaad wel eens",roekeloos door de bochten," , maar dit is eerder",roekeloos door de bocht,"ADJ(vrij,basis,zonder) VZ(init) LID(bep,stan,rest) N(soort,mv,basis)",ADJ VZ LID N,,,,,,,,,,,,,,,,,,,,,,,"   ",p.3.s.9.w.6 p.3.s.9.w.7 p.3.s.9.w.8 p.3.s.9.w.9,"   ","   "
WR-P-P-G-0000075469,Hoop groeit voor economie Nederland," kwartaal beloven wel dat de",economie door de bocht," is . ` Groei '",economie door de bocht,"N(soort,ev,basis,zijd,stan) VZ(init) LID(bep,stan,rest) N(soort,ev,basis,zijd,stan)",N VZ LID N,,,,,,,,,,,,,,,,,,,,,,,"   ",p.1.s.1.w.19 p.1.s.1.w.20 p.1.s.1.w.21 p.1.s.1.w.22,"   ","   "
